A1: Только качественные бумажные пакеты. Start-polus.

A1: [ Up ] [ Банты ] [ Прайс на подарочную упаковку. ] [ Прайс лист на бумажные пакеты. ] [ Полиэтиленовые пакеты ] Банты бабочки. Банты звездочки. Бант розочка Бант цветок. Бант шар.

A1: № | B1: Наименование | C1: Мин, кол-во | D1: Цена за штуку | E1: Примечание
A2: Банты бабочки./до 9 цветов в каждой позиции/
A4: Банты звездочки /ассорти до 8 цветов в каждой позиции/
A6: Бант розочка /ассорти до 9 цветов в каждой позиции/
A7: 75 | B7: Бант розочка матерчатая 01/02 | C7: 25 | D7: 1.41
A8: =A82+1 -> 76 | B8: Бант розочка матерчатая 03 | C8: 25 | D8: 1.74
A9: 77 | B9: Бант розочка матерчатая 06/01 | C9: 25 | D9: 2.94
A10: =A84+1 -> 78 | B10: Бант розочка матерчатая 06/02 | C10: 25 | D10: 2.94
A11: =A85+1 -> 79 | B11: Бант розочка матерчатая 07 | C11: 25 | D11: 4.79
A12: =A86+1 -> 80 | B12: Бант розочка матерчатая 08 | C12: 25 | D12: 5
A13: =A87+1 -> 81 | B13: Бант розочка матовая 01-мал. С листиками | C13: 24 | D13: 2.6
A14: =A88+1 -> 82 | B14: Бант розочка простая 02-мини | C14: 12 | D14: 1.2
A15: =A89+1 -> 83 | B15: Бант розочка простая 03 мал. | C15: 12 | D15: 1.74
A16: =A90+1 -> 84 | B16: Бант розочка цветная 01А мал. | C16: 12 | D16: 2.61
A17: =A91+1 -> 85 | B17: Бант розочка цветная 02А средн.. | C17: 5 | D17: 4.35
A18: =A92+1 -> 86 | B18: Бант розочка цветная 03А большая. | C18: 24 | D18: 6.5
A19: Бант цветок / до 9 цветов в каждой позиции/
A20: =A93+1 -> 87 | B20: 22А простой 22х1000 мм. | C20: 10 | D20: 3.92
A21: =A95+1 -> 88 | B21: 22Б с золотой полосой 22х1000 мм. | C21: 10 | D21: 3.92
A22: =A96+1 -> 89 | B22: 22В металлизированный 22х1000 мм. | C22: 10 | D22: 5.44
A23: =A97+1 -> 90 | B23: 22Д перламутровый 22х1000 мм. | C23: 10 | D23: 6.53
A24: =A98+1 -> 91 | B24: 32А простой 32х1000 мм. | C24: 10 | D24: 5.44
A25: =A99+1 -> 92 | B25: 32Б с золотой полосой 32х1000 мм. | C25: 10 | D25: 6.09
A26: =A100+1 -> 93 | B26: 32В металлизированный 32х1000 мм. | C26: 10 | D26: 6.53
A27: =A101+1 -> 94 | B27: 32Д перламутровый 32х1000 мм. | C27: 10 | D27: 7.18
A28: Бант шар /до 20 дизайнов в одной позиции/

A1: 1 | B1: 12 А (матов) 12х260 мм, | C1: 10 | D1: 00.85
A2: =A1+1 -> 2 | B2: 12 Б (с золотой полосой) 12х260 мм, | C2: 10 | D2: 00.8 | E2: Суперцена!!
A3: =A2+1 -> 3 | B3: 12В (металл,) 12х260 мм, | C3: 10 | D3: 00.98
A4: =A3+1 -> 4 | B4: 12 Г (гологр,) 12х260 мм, | C4: 10 | D4: 00.99
A5: =A4+1 -> 5 | B5: 12 Д (перлам,) 12х260 мм, | C5: 10 | D5: 1.08
A6: =A5+1 -> 6 | B6: 13Е атласная 12х260 мм. | C6: 10 | D6: 1.84
A7: =A6+1 -> 7 | B7: 15 Б (с золотой полосой) 15 х 380 мм. | C7: 10 | D7: 1
A8: =A7+1 -> 8 | B8: 15 В (металл) | C8: 10 | D8: 1.42
A9: =A8+1 -> 9 | B9: 15 Г (голографический) | C9: 10 | D9: 1.5
A10: =A9+1 -> 10 | B10: 15 Д (перламутровый) | C10: 10 | D10: 1.63
A11: =A10+1 -> 11 | B11: 18 А (матов,) 18 х420 мм, | C11: 10 | D11: 1.41
A12: =A11+1 -> 12 | B12: 18 Б (с зол,пол,) 18 х420 мм, | C12: 10 | D12: 1.3 | E12: Суперцена!!
A13: =A12+1 -> 13 | B13: 18 В (металл,) 18 х420 мм, | C13: 10 | D13: 2.18
A14: =A13+1 -> 14 | B14: 18 Г (гологр,) 18 х420 мм, | C14: 10 | D14: 1.8
A15: =A14+1 -> 15 | B15: 18 Д (перлам,) 18 х420 мм, | C15: 10 | D15: 2.61
A16: =A15+1 -> 16 | B16: 20 А (прост,) 20х500 мм, | C16: 10 | D16: 00.72
A17: =A16+1 -> 17 | B17: 22 А (матов,) 24 х500 мм, | C17: 10 | D17: 1.74
A18: =A17+1 -> 18 | B18: 22 Б(с зол,пол,) 24х500 мм, | C18: 10 | D18: 1.6
A19: =A18+1 -> 19 | B19: 22 В (металл,) 24 х500 мм, | C19: 10 | D19: 2.05
A20: =A19+1 -> 20 | B20: 22 Г (гологр,) 24 х500 мм, | C20: 10 | D20: 2.14
A21: =A20+1 -> 21 | B21: 22 Д (перлам,) 24 х500 мм, | C21: 10 | D21: 3.92
A22: =A21+1 -> 22 | B22: 30 А (матов,) 30 х600 мм, | C22: 10 | D22: 2.16
A23: =A22+1 -> 23 | B23: 30 Б(с зол,пол,) 30х600 мм, | C23: 10 | D23: 2.49
A24: =A23+1 -> 24 | B24: 30 В (металл,) 30 х600 мм, | C24: 10 | D24: 2.81
A25: =A24+1 -> 25 | B25: 30 Г(гологр,) 30х600мм, | C25: 10 | D25: 2.78
A26: =A25+1 -> 26 | B26: 30Д (перлам,) 30 х600 мм, | C26: 10 | D26: 4.35
A27: =A26+1 -> 27 | B27: 30 Е(металл, с рис,) 30х600мм, | C27: 10 | D27: 5.44
A28: =A27+1 -> 28 | B28: 30Ж (атл. с сетк., асс.) 30 х600 мм, | C28: 10 | D28: 5.44
A29: =A28+1 -> 29 | B29: 48 А (матов,) 48х940 | C29: 10 | D29: 3.9
A30: =A29+1 -> 30 | B30: 48 Б (с зол,пол,) 48х940 | C30: 10 | D30: 5
A31: =A30+1 -> 31 | B31: 48 В (металл,) 48х940 | C31: 10 | D31: 6.09
A32: =A31+1 -> 32 | B32: 48 Г (гологр,) 48х940 | C32: 10 | D32: 6.84
A33: =A32+1 -> 33 | B33: 48 Д (перл,) 48х940 | C33: 10 | D33: 6.84

A1: 34 | B1: 05А-1 простая | C1: 100 | D1: 1.2
A2: =A1+1 -> 35 | B2: 05А-2 метал. Мал. | C2: 100 | D2: 1.2
A3: =A2+1 -> 36 | B3: 05Б-2 гологр. | C3: 100 | D3: 1.31
A4: =A3+1 -> 37 | B4: 05Б-3 шотл. | C4: 100 | D4: 1.31
A5: 36 | B5: 05В-2 с золотой полосой | C5: 100 | D5: 1.41
A6: =A5+1 -> 37 | B6: 05Г-1 сатин. | C6: 100 | D6: 1.63
A7: =A6+1 -> 38 | B7: 10А-1 перлам. | C7: 18 | D7: 2.5
A8: =A7+1 -> 39 | B8: 10 Б-1 с золотой полосой без хвоста | C8: 18 | D8: 2.72
A9: =A8+1 -> 40 | B9: 10Б-3 металл. | C9: 18 | D9: 2.72
A10: =A9+1 -> 41 | B10: 10 Б-4 с золотой полосой | C10: 18 | D10: 2.72
A11: =A10+1 -> 42 | B11: 12 А-1 голограф. | C11: 18 | D11: 2.83
A12: =A11+1 -> 43 | B12: 12 А-2 перламутр. | C12: 18 | D12: 2.83
A13: =A12+1 -> 44 | B13: 18А-1 голограф. | C13: 20 | D13: 4.68
A14: =A13+1 -> 45 | B14: 20А-1 цветная | C14: 20 | D14: 2.83
A15: =A14+1 -> 46 | B15: 20 Б-2 с золотой полосой | C15: 20 | D15: 3.92
A16: =A15+1 -> 47 | B16: 20 Б-3 металл. | C16: 20 | D16: 3.92
A17: =A16+1 -> 48 | B17: 20 В-2 металл. С печатью | C17: 20 | D17: 4.35
A18: =A17+1 -> 49 | B18: 30А-1 матовая | C18: 12 | D18: 6.53
A19: =A18+1 -> 50 | B19: 32А-1 цветная | C19: 12 | D19: 6.53
A20: 52 | B20: Бант звезда Glitter 01 | C20: 100 | D20: 1.40
A21: 53 | B21: Бант звезда Glitter 02 | C21: 100 | D21: 2.85
A22: =A21+1 -> 54 | B22: Бант звезда Glitter 03 | C22: 50 | D22: 4.5
A23: =A22+1 -> 55 | B23: Бант звезда Glitter 04 | C23: 32 | D23: 4.68
A24: =A23+1 -> 56 | B24: Бант звезда Glitter 05 | C24: 32 | D24: 5.75
A25: =A24+1 -> 57 | B25: Бант звезда комб. W-TYPE+W-TYPE 02 | C25: 100 | D25: 2.34
A26: =A25+1 -> 58 | B26: Бант звезда комб. W-TYPE+W-TYPE 03 | C26: 50 | D26: 4.9
A27: =A26+1 -> 59 | B27: Бант звезда комб. W-TYPE+W-TYPE 04 | C27: 32 | D27: 7.05
A28: 72 | B28: Бант звезда металл 03 | C28: 50 | D28: 3.12
A29: 73 | B29: Бант звезда перламутровый 03 | C29: 50 | D29: 3.64
A30: 74 | B30: Бант звезда перламутровый Тиснен. 04 | C30: 32 | D30: 4.68

A1: 95 | B1: Бант-шар 15А простой | C1: 10 | D1: 3.48
A2: =A1+1 -> 96 | B2: Бант-шар 15Б простой с рисунком | C2: 10 | D2: 3.48
A3: =A2+1 -> 97 | B3: Бант-шар 15В с 3мя золотыми полосами | C3: 10 | D3: 4.03
A4: =A3+1 -> 98 | B4: Бант-шар 15Г матовый металлизированный | C4: 10 | D4: 4.35
A5: =A4+1 -> 99 | B5: Бант-шар 15Д перламутровый | C5: 10 | D5: 5.44
A6: =A5+1 -> 100 | B6: Бант-шар 18А простой | C6: 10 | D6: 4.35
A7: =A6+1 -> 101 | B7: Бант-шар 18Б простой с рисунком | C7: 10 | D7: 4.35
A8: =A7+1 -> 102 | B8: Бант-шар 18В с 3мя золотыми полосами | C8: 10 | D8: 5
A9: =A8+1 -> 103 | B9: Бант-шар 18Г матовый металлизированный | C9: 10 | D9: 5.44
A10: =A9+1 -> 104 | B10: Бант-шар 32Д перламутровый | C10: 10 | D10: 5.9
A11: =A10+1 -> 105 | B11: Бант-шар 32А простой | C11: 10 | D11: 5.44
A12: =A11+1 -> 106 | B12: Бант-шар 32Б простой с рисунком | C12: 10 | D12: 5.44
A13: =A12+1 -> 107 | B13: Бант-шар 32В с 3мя золотыми полосами | C13: 10 | D13: 6.09
A14: =A13+1 -> 108 | B14: Бант-шар 32Г матовый металлизированный | C14: 10 | D14: 6.09
A15: =A14+1 -> 109 | B15: 50 А (однотонный) | C15: 10 | D15: 9.03
A16: =A15+1 -> 110 | B16: 50 Б (с рисунком) | C16: 10 | D16: 9.03
A17: =A16+1 -> 111 | B17: 50 В ( с 3мя золотыми полосами) | C17: 10 | D17: 10.88
A18: =A17+1 -> 112 | B18: 50 Е (2й простой) | C18: 10 | D18: 10 | E18: Суперцена!!

A1: ©Авторские права на разработку и дизайн веб-сайта принадлежат ООО "Старт Полюс" Обновлено: октября 02, 2006